_id,title,content,category,author,createdAt,updatedAt,__v
66c76844966404aa721515a0,New Post Test,"<p>Curabitur pretium tincidunt lacus. Nulla gravida orci a odio. Nullam varius, turpis et commodo pharetra, est eros bibendum elit, nec luctus magna felis sollicitudin mauris. Integer in mauris eu nibh euismod gravida. Duis ac tellus et risus vulputate vehicula. Donec lobortis risus a elit. Etiam tempor. Ut ullamcorper, ligula eu tempor congue, eros est euismod turpis, id tincidunt sapien risus a quam. Maecenas fermentum consequat mi. Donec fermentum. Pellentesque malesuada nulla a mi. Duis sapien sem, aliquet nec, commodo eget, consequat quis, neque. Aliquam faucibus, elit ut dictum aliquet, felis nisl adipiscing sapien, sed malesuada diam lacus eget erat. Cras mollis scelerisque nunc. Nullam arcu. Aliquam consequat. Curabitur augue lorem, dapibus quis, laoreet et, pretium ac, nisi. Aenean magna nisl, mollis quis, molestie eu,</p>",Other,66c767c3404e6c9bbdb64a84,2024-08-22T16:33:08.400Z,2024-08-22T16:33:08.400Z,0
66c76a89404e6c9bbdb64a8c,The Rise of Edge Computing: Bringing Processing Power Closer to Home,"<p>In recent years, cloud computing has dominated the tech landscape, offering unprecedented storage and processing capabilities. However, a new paradigm is emerging: edge computing. This innovative approach brings data processing closer to the source, reducing latency and enhancing real-time capabilities.</p><p>Edge computing involves processing data near the edge of the network, where it's generated, rather than in a centralized data-processing warehouse. This shift is particularly crucial for IoT devices, autonomous vehicles, and smart cities, where milliseconds can make a significant difference.</p><p>Key benefits of edge computing include:</p><ol><li>Reduced latency</li><li>Improved data security and privacy</li><li>Lower bandwidth costs</li><li>Enhanced reliability in areas with poor connectivity</li></ol><p>As we move towards a more connected world, edge computing is set to revolutionize how we interact with technology in our daily lives. From smarter homes to more efficient industrial processes, the possibilities are endless.</p>",Technology,66c767c3404e6c9bbdb64a84,2024-08-22T16:42:49.341Z,2024-08-22T16:42:49.341Z,0
66c76abb966404aa7215164e,Hidden Gems of Portugal: Beyond Lisbon and Porto,"<p>Portugal has become an increasingly popular tourist destination, with Lisbon and Porto often stealing the spotlight. However, this beautiful country has so much more to offer. Let's explore some of Portugal's lesser-known but equally enchanting locations.</p><ol><li>Óbidos: Step back in time in this medieval walled town, famous for its narrow cobblestone streets and whitewashed houses adorned with colorful flowers.</li><li>Berlengas Islands: A small archipelago off the coast of Peniche, perfect for nature lovers and those seeking tranquility. Don't miss the iconic lighthouse and crystal-clear waters.</li><li>Monsanto: Known as ""the most Portuguese village in Portugal,"" Monsanto is built among giant boulders, creating a unique and picturesque landscape.</li><li>Tavira: Located in the Algarve region, Tavira offers a more authentic Portuguese experience away from the usual tourist crowds, with beautiful beaches and rich history.</li><li>Douro Valley: While Porto is famous for its port wine, venture into the Douro Valley to experience the breathtaking landscapes where the grapes are grown.</li></ol><p>These hidden gems offer a chance to experience Portugal's rich culture, stunning landscapes, and warm hospitality away from the usual tourist trail.</p>",Travel,66c767c3404e6c9bbdb64a84,2024-08-22T16:43:39.179Z,2024-08-22T16:46:31.491Z,0
66c76adf404e6c9bbdb64a99,Exploring the World of Fermented Foods: Health Benefits and Culinary,"<p>Fermented foods have been a part of human diets for thousands of years, but they're experiencing a resurgence in popularity due to their potential health benefits and unique flavors. Let's dive into the world of fermentation and discover some exciting options to add to your diet.</p><p>What is fermentation? Fermentation is a metabolic process that converts sugar to acids, gases, or alcohol using yeast or bacteria. This process not only preserves food but also creates beneficial probiotics.</p><p>Popular fermented foods:</p><ol><li>Kombucha: A tangy, effervescent tea rich in probiotics</li><li>Kimchi: Spicy Korean fermented vegetables, typically cabbage</li><li>Kefir: A fermented milk drink, similar to yogurt but with more probiotics</li><li>Sauerkraut: Finely sliced fermented cabbage</li><li>Miso: A Japanese fermented soybean paste</li></ol><p>Health benefits:</p><ul><li>Improved digestion</li><li>Enhanced immune function</li><li>Better nutrient absorption</li><li>Potential mood regulation</li></ul><p>Incorporating fermented foods into your diet can be a delicious way to support your overall health. Start small and experiment with different types to find your favorites!</p>",Food,66c767c3404e6c9bbdb64a84,2024-08-22T16:44:15.806Z,2024-08-22T16:46:12.791Z,0
66c76b0b404e6c9bbdb64a9e,Embracing Minimalism: Simplify Your Life and Find More Joy,"<p>In our fast-paced, consumer-driven world, the concept of minimalism has gained traction as a way to simplify life and focus on what truly matters. But what exactly is minimalism, and how can it improve your life?</p><p>Minimalism is not about living with nothing – it's about living with intention. It's about identifying what adds value to your life and eliminating the rest. Here are some ways to embrace minimalism:</p><ol><li>Declutter your space: Start by going through your belongings and keeping only what you need or truly love.</li><li>Simplify your wardrobe: Create a capsule wardrobe with versatile pieces that mix and match easily.</li><li>Digital declutter: Unsubscribe from unnecessary emails, delete unused apps, and organize your digital files.</li><li>Practice mindful consumption: Before buying something new, ask yourself if it truly adds value to your life.</li><li>Focus on experiences: Shift your focus from acquiring things to creating meaningful experiences.</li></ol><p>Benefits of minimalism:</p><ul><li>Reduced stress and anxiety</li><li>More time and energy for what matters</li><li>Financial freedom</li><li>Increased productivity</li><li>Environmental benefits</li></ul><p>Remember, minimalism looks different for everyone. The key is to find a balance that works for you and allows you to live a more intentional, fulfilling life.</p>",Lifestyle,66c767c3404e6c9bbdb64a84,2024-08-22T16:44:59.499Z,2024-08-22T16:44:59.499Z,0
66c76b2e966404aa72151659,Mastering the Art of Passive Income: Building Wealth While You Sleep,"<p>Passive income – the holy grail of personal finance. The idea of making money while you sleep is undeniably appealing, but how can you turn this dream into reality? Let's explore some strategies for building passive income streams.</p><ol><li>Dividend-paying stocks: Invest in companies that regularly distribute a portion of their profits to shareholders.</li><li>Real estate investment trusts (REITs): Pool your money with other investors to own income-producing real estate without the hassle of property management.</li><li>Create and sell digital products: E-books, online courses, or stock photography can generate income long after the initial creation.</li><li>Rental properties: While not entirely passive, owning and renting out properties can provide a steady income stream.</li><li>Peer-to-peer lending: Lend money to individuals or small businesses through platforms like Prosper or LendingClub.</li><li>High-yield savings accounts or CDs: While the returns may be modest, these options offer a safe way to earn passive income.</li><li>Affiliate marketing: Promote other people's products and earn a commission on sales.</li></ol><p>Remember, building passive income often requires upfront work or investment. It's crucial to do your research, understand the risks involved, and diversify your income streams. With patience and persistence, you can create a portfolio of passive income sources that contribute to your long-term financial security.</p>",Other,66c767c3404e6c9bbdb64a84,2024-08-22T16:45:34.057Z,2024-08-22T16:45:34.057Z,0
66c76bb5aef76eb3cb3bf84e,The Future of Wearable Tech: Beyond Smartwatches,"<p>Wearable technology has come a long way since the introduction of smartwatches. Today, we're seeing innovative devices that go far beyond tracking steps and heart rate. From smart clothing to augmented reality glasses, the future of wearables is exciting and diverse.</p><p>Some emerging wearable technologies include:</p><ol><li>Smart fabrics that can monitor vital signs and adjust temperature</li><li>Brain-computer interfaces for direct mental control of devices</li><li>Haptic feedback gloves for enhanced virtual reality experiences</li><li>Implantable health monitors for continuous medical data collection</li></ol><p>As these technologies evolve, we can expect wearables to become more integrated into our daily lives, offering seamless and intuitive ways to interact with the digital world.</p>",Technology,66c768f5aef76eb3cb3bf7b4,2024-08-22T16:47:49.038Z,2024-08-22T16:47:49.038Z,0
66c76bd8aef76eb3cb3bf853,Quantum Computing: Unlocking New Frontiers in Processing Power,"<p>Quantum computing represents a paradigm shift in how we process information. Unlike classical computers that use bits (0s and 1s), quantum computers use quantum bits or qubits, which can exist in multiple states simultaneously.</p><p>Key advantages of quantum computing:</p><ol><li>Solving complex problems exponentially faster than classical computers</li><li>Revolutionizing fields like cryptography, drug discovery, and financial modeling</li><li>Optimizing supply chains and logistics on a global scale</li></ol><p>While still in its early stages, quantum computing has the potential to transform industries and solve problems previously thought impossible.</p>",Technology,66c768f5aef76eb3cb3bf7b4,2024-08-22T16:48:24.777Z,2024-08-22T16:48:24.777Z,0
66c76bf9404e6c9bbdb64ac2,The Ethics of AI: Navigating the Challenges of Artificial Intelligence,"<p>As AI becomes increasingly integrated into our lives, we must grapple with the ethical implications of this powerful technology. From bias in algorithms to the potential for job displacement, the challenges are complex and multifaceted.</p><p>Key ethical considerations in AI:</p><ol><li>Ensuring fairness and eliminating bias in AI decision-making</li><li>Maintaining privacy and data protection</li><li>Addressing the impact of AI on employment</li><li>Establishing accountability for AI-driven decisions</li></ol><p>As we continue to develop and deploy AI systems, it's crucial that we prioritize ethical considerations to ensure that this technology benefits society as a whole.</p>",Technology,66c768f5aef76eb3cb3bf7b4,2024-08-22T16:48:57.125Z,2024-08-22T16:48:57.125Z,0
66c76c2f404e6c9bbdb64ac7,Off the Beaten Path: Exploring Japan's Rural Treasures,"<p>While Tokyo, Kyoto, and Osaka are must-visit destinations in Japan, the country's rural areas offer a glimpse into traditional Japanese life and stunning natural beauty.</p><p>Some hidden gems to explore:</p><ol><li>Shirakawa-go: A UNESCO World Heritage site known for its traditional gassho-zukuri farmhouses</li><li>Yakushima: An island covered in ancient cedar forests, inspiring Studio Ghibli's ""Princess Mononoke""</li><li>Naoshima: A small island in the Seto Inland Sea, famous for its modern art museums and outdoor sculptures</li><li>Koyasan: A spiritual retreat in Wakayama Prefecture, home to over 100 temples</li></ol><p>Venturing beyond Japan's major cities allows you to experience the country's rich cultural heritage and breathtaking landscapes in a more intimate setting.</p>",Travel,66c768f5aef76eb3cb3bf7b4,2024-08-22T16:49:51.819Z,2024-08-22T16:49:51.819Z,0
66c76c64966404aa7215166a,Sustainable Travel: Exploring the World Responsibly,"<p>As awareness of climate change grows, many travelers are seeking ways to explore the world while minimizing their environmental impact. Sustainable travel involves making choices that respect local communities, preserve natural and cultural heritage, and reduce carbon footprints.</p><p>Tips for sustainable travel:</p><ol><li>Choose eco-friendly accommodations</li><li>Use public transportation or rent bicycles</li><li>Support local businesses and artisans</li><li>Participate in conservation activities or volunteering opportunities</li><li>Pack reusable items to reduce waste</li></ol><p>By traveling sustainably, we can ensure that the world's most beautiful destinations remain pristine for future generations to enjoy.</p>",Travel,66c767c3404e6c9bbdb64a84,2024-08-22T16:50:44.895Z,2024-08-22T16:50:44.895Z,0
